Text#,Type,Issued,Title,Language,Authors,Subjects,LoCC,Bookshelves
162,Text,1994-09-01,Take Me for a Ride: Coming of Age in a Destructive Cult,en,"Laxer, Mark E.","Lenz, Frederick, 1950-; Cults -- United States",BL,Browsing: Culture/Civilization/Society; Browsing: Psychiatry/Psychology; Browsing: Religion/Spirituality/Paranormal
163,Text,1994-09-01,Flower Fables,en,"Alcott, Louisa May, 1832-1888","Short stories; Children's stories, American; Fairy tales -- United States; Flowers -- Juvenile fiction; Flowers -- Juvenile poetry; Fairies -- Juvenile poetry",PZ,Children's Literature; Browsing: Children & Young Adult Reading; Browsing: Literature
164,Text,1994-09-01,Twenty Thousand Leagues under the Sea,en,"Verne, Jules, 1828-1905",Science fiction; Submarines (Ships) -- Fiction; Sea stories; Adventure stories; Underwater exploration -- Fiction,PQ,Science Fiction; Browsing: Literature; Browsing: Science-Fiction & Fantasy; Browsing: Fiction
165,Text,2006-03-12,McTeague: A Story of San Francisco,en,"Norris, Frank, 1870-1902",Didactic fiction; Psychological fiction; Married people -- Fiction; Murderers -- Fiction; San Francisco (Calif.) -- Fiction; Avarice -- Fiction; Dentists -- Fiction,PS,Browsing: Culture/Civilization/Society; Browsing: Literature; Browsing: Fiction
166,Text,2006-03-12,Summer,en,"Wharton, Edith, 1862-1937",Young women -- Fiction; Love stories; Guardian and ward -- Fiction; Man-woman relationships -- Fiction; Berkshire Hills (Mass.) -- Fiction,PS,Browsing: Culture/Civilization/Society; Browsing: Literature; Browsing: Fiction
167,Text,1994-09-01,American Hand Book of the Daguerreotype,en,"Humphrey, S. D. (Samuel Dwight), 1823-1883",Photography; Daguerreotype,TR,Photography; Art; Browsing: Art & Photography; Browsing: Computers & Technology
168,Text,1994-10-01,The History and Practice of the Art of Photography,en,"Snelling, Henry Hunt, 1816-1897",Photography; Daguerreotype,TR,Photography; Art; Browsing: Art & Photography; Browsing: Computers & Technology
169,Text,1994-10-01,The Well at the World's End: A Tale,en,"Morris, William, 1834-1896",Fantasy fiction; Quests (Expeditions) -- Fiction,PR,Fantasy; Browsing: Literature; Browsing: Science-Fiction & Fantasy; Browsing: Fiction
170,Text,1994-10-01,The Haunted Hotel: A Mystery of Modern Venice,en,"Collins, Wilkie, 1824-1889",Venice (Italy) -- Fiction; Detective and mystery stories; Hotels -- Fiction,PR,Browsing: Crime/Mystery; Browsing: Literature; Browsing: Fiction
171,Text,2006-03-12,Charlotte Temple,en,"Rowson, Mrs., 1762-1824",British -- New York (State) -- New York -- Fiction; Runaway teenagers -- Fiction; New York (N.Y.) -- Fiction; Didactic fiction; Psychological fiction; Illegitimate children -- Fiction; Soldiers -- Fiction; Elopement -- Fiction; Teenage girls -- Fiction; Betrayal -- Fiction; Seduction -- Fiction; Teenage pregnancy -- Fiction,PS,Browsing: Culture/Civilization/Society; Browsing: Literature; Browsing: Fiction
172,Text,1994-10-01,The Haunted Bookshop,en,"Morley, Christopher, 1890-1957","Booksellers and bookselling -- Fiction; Brooklyn (New York, N.Y.) -- Fiction; Mystery and detective stories",PS,Bibliomania; Browsing: Crime/Mystery; Browsing: Literature; Browsing: Fiction
173,Text,1994-10-01,The Insidious Dr. Fu Manchu,en,"Rohmer, Sax, 1883-1959","Detective and mystery stories; Fu Manchu, Doctor (Fictitious character) -- Fiction; Criminals -- Fiction",PR,Crime Fiction; Browsing: Crime/Mystery; Browsing: Literature; Browsing: Fiction
174,Text,1994-10-01,The Picture of Dorian Gray,en,"Wilde, Oscar, 1854-1900","Didactic fiction; Supernatural -- Fiction; Conduct of life -- Fiction; Portraits -- Fiction; Great Britain -- History -- Victoria, 1837-1901 -- Fiction; London (England) -- History -- 1800-1950 -- Fiction; Appearance (Philosophy) -- Fiction; Paranormal fiction",PR,Gothic Fiction; Movie Books; Browsing: Literature; Browsing: Philosophy & Ethics; Browsing: Fiction
175,Text,1994-10-01,The Phantom of the Opera,en,"Leroux, Gaston, 1868-1927",Horror tales; Musical fiction; Opera -- Fiction; Paris (France) -- Fiction; Composers -- Fiction; Phantom of the Opera (Fictitious character) -- Fiction; French fiction -- Translations into English,PQ,Opera; Gothic Fiction; Movie Books; Browsing: Literature; Browsing: Performing Arts/Film; Browsing: Fiction
176,Text,2006-03-12,Roderick Hudson,en,"James, Henry, 1843-1916",Man-woman relationships -- Fiction; Rome (Italy) -- Fiction; Americans -- Italy -- Fiction; Sculptors -- Fiction,PS,Browsing: Culture/Civilization/Society; Browsing: Literature; Browsing: Fiction
177,Text,2006-03-12,The American,en,"James, Henry, 1843-1916",Psychological fiction; Love stories; Widows -- Fiction; Courtship -- Fiction; Paris (France) -- Fiction; Aristocracy (Social class) -- Fiction; Culture conflict -- Fiction; Separation (Psychology) -- Fiction; Americans -- France -- Fiction,PS,Browsing: Culture/Civilization/Society; Browsing: Literature; Browsing: Fiction
178,Text,2006-03-15,Confidence,en,"James, Henry, 1843-1916",Male friendship -- Fiction; Man-woman relationships -- Fiction; British -- Europe -- Fiction; Americans -- Europe -- Fiction,PS,Browsing: Culture/Civilization/Society; Browsing: Literature; Browsing: Fiction
179,Text,2006-03-15,The Europeans,en,"James, Henry, 1843-1916",Humorous stories; Domestic fiction; Siblings -- Fiction; Boston (Mass.) -- Fiction; Upper class -- Fiction; Europeans -- United States -- Fiction,PS,Browsing: Culture/Civilization/Society; Browsing: Humour; Browsing: Literature; Browsing: Fiction
180,Text,1994-11-01,The 1994 CIA World Factbook,en,United States. Central Intelligence Agency,"World politics -- Handbooks, manuals, etc.; Geography -- Handbooks, manuals, etc.; Political science -- Handbooks, manuals, etc.; Political statistics -- Handbooks, manuals, etc.",G,CIA World Factbooks; Browsing: Encyclopedias/Dictionaries/Reference; Browsing: Politics; Browsing: Travel & Geography
181,Text,2001-01-01,The Project Gutenberg RST Manual,en,"Perathoner, Marcello","Electronic books; Electronic publishing -- Handbooks, manuals, etc.",Z,Browsing: Computers & Technology; Browsing: Encyclopedias/Dictionaries/Reference; Browsing: Teaching & Education
200,Text,1995-01-01,"The Project Gutenberg Encyclopedia, Volume 1 of 28",en,Project Gutenberg,Encyclopedias and dictionaries,AE,Reference; Browsing: Encyclopedias/Dictionaries/Reference
201,Text,1995-01-01,Flatland: A Romance of Many Dimensions,en,"Abbott, Edwin Abbott, 1838-1926",Fourth dimension,QA,Mathematics; Science Fiction; Browsing: Mathematics; Browsing: Science - General; Browsing: Science-Fiction & Fantasy
202,Text,2008-07-02,My Bondage and My Freedom,en,"Douglass, Frederick, 1818-1895","Douglass, Frederick, 1818-1895; Enslaved persons -- Maryland -- Social conditions -- 19th century; African American abolitionists -- Biography; Abolitionists -- United States -- Biography; Antislavery movements -- United States -- History -- 19th century; Fugitive slaves -- Maryland -- Biography; Plantation life -- Maryland -- History -- 19th century",E300,Slavery; African American Writers; Browsing: Biographies; Browsing: Culture/Civilization/Society; Browsing: History - American
203,Text,2006-01-13,Uncle Tom's Cabin,en,"Stowe, Harriet Beecher, 1811-1896",Slavery -- Fiction; Didactic fiction; Political fiction; Master and servant -- Fiction; African Americans -- Fiction; Southern States -- Fiction; Fugitive slaves -- Fiction; Plantation life -- Fiction; Uncle Tom (Fictitious character) -- Fiction; Enslaved persons -- Fiction,PS,US Civil War; Slavery; Banned Books from Anne Haight's list; Browsing: Culture/Civilization/Society; Browsing: History - American; Browsing: Politics; Browsing: Fiction
204,Text,2008-07-09,The innocence of Father Brown,en,"Chesterton, G. K. (Gilbert Keith), 1874-1936","England -- Fiction; Clergy -- Fiction; Detective and mystery stories, English; Catholics -- Fiction; Brown, Father (Fictitious character) -- Fiction; Detective and mystery stories, English -- Translations into Finnish",PR,Detective Fiction; Browsing: Crime/Mystery; Browsing: Literature; Browsing: Fiction
205,Text,1995-01-01,"Walden, and On The Duty Of Civil Disobedience",en,"Thoreau, Henry David, 1817-1862","Civil disobedience; Authors, American -- 19th century -- Biography; Thoreau, Henry David, 1817-1862 -- Homes and haunts -- Massachusetts -- Walden Woods; Wilderness areas -- Massachusetts -- Walden Woods; Natural history -- Massachusetts -- Walden Woods; Solitude; Government, Resistance to; Walden Woods (Mass.) -- Social life and customs",PS,Browsing: Biographies; Browsing: Culture/Civilization/Society; Browsing: Literature
206,Text,2008-06-29,"The Martin Luther King, Jr. Day, 1995, Memorial Issue",en,Various,"Martin Luther King, Jr., Day; Civil rights movements; United States -- History; African Americans -- Social conditions -- To 1964",E151,Browsing: Culture/Civilization/Society; Browsing: History - American
207,Text,1995-01-01,The Spell of the Yukon and Other Verses,en,"Service, Robert W. (Robert William), 1874-1958",Yukon River Valley (Yukon and Alaska) -- Poetry,PS,Canada; Browsing: Culture/Civilization/Society; Browsing: Literature; Browsing: Poetry; Browsing: Travel & Geography
208,Text,2008-07-03,Daisy Miller: A Study,en,"James, Henry, 1843-1916",Psychological fiction; Young women -- Fiction; Europe -- Fiction; Americans -- Europe -- Fiction,PS,Browsing: Culture/Civilization/Society; Browsing: Literature; Browsing: Psychiatry/Psychology; Browsing: Travel & Geography; Browsing: Fiction
209,Text,1995-02-01,The Turn of the Screw,en,"James, Henry, 1843-1916",England -- Fiction; Psychological fiction; Governesses -- Fiction; Ghost stories; Children -- Fiction,PS,Best Books Ever Listings; Gothic Fiction; Horror; Opera; Browsing: Literature; Browsing: Psychiatry/Psychology; Browsing: Fiction
210,Text,2008-07-09,An International Episode,en,"James, Henry, 1843-1916",Americans -- England -- Fiction; Manners and customs -- Fiction; British -- United States -- Fiction; New York (State) -- Social life and customs -- Fiction; London (England) -- Social life and customs -- Fiction,PS,Browsing: Culture/Civilization/Society; Browsing: Literature; Browsing: Fiction
211,Text,2008-06-29,The Aspern Papers,en,"James, Henry, 1843-1916",Venice (Italy) -- Fiction; Psychological fiction; Man-woman relationships -- Fiction; Poets -- Fiction; Manuscripts -- Collectors and collecting -- Fiction,PS,Browsing: Culture/Civilization/Society; Browsing: Literature; Browsing: Fiction
212,Text,1995-02-01,A List of Factorial Math Constants,en,Unknown,Mathematics; Factorials,QA,Mathematics; Browsing: Mathematics; Browsing: Science - General
213,Text,1995-02-01,The Man from Snowy River,en,"Paterson, A. B. (Andrew Barton), 1864-1941",Frontier and pioneer life -- Australia -- Poetry,PR,Australia; Browsing: Culture/Civilization/Society; Browsing: Literature; Browsing: Poetry; Browsing: Fiction
214,Text,2008-07-03,"In the Days When the World Was Wide, and Other Verses",en,"Lawson, Henry, 1867-1922",Frontier and pioneer life -- Australia -- Poetry; Australian poetry,PR,Australia; Browsing: Culture/Civilization/Society; Browsing: Literature; Browsing: Poetry
215,Text,2008-07-02,The call of the wild,en,"London, Jack, 1876-1916",Dogs -- Fiction; Adventure stories; Nature stories; Klondike River Valley (Yukon) -- Fiction; Sled dogs -- Fiction; Pet theft -- Fiction; Feral dogs -- Fiction; Animal welfare -- Fiction,PS,Animals-Domestic; Adventure; Best Books Ever Listings; Movie Books; Banned Books from Anne Haight's list; Banned Books List from the American Library Association; Browsing: Nature/Gardening/Animals; Browsing: Fiction
216,Text,1995-02-01,"The Tao Teh King, or the Tao and its Characteristics",en,"Laozi; Legge, James, 1815-1897 [Translator]","Philosophy, Chinese; Taoism -- Sacred books",BL,Paganism; Browsing: Philosophy & Ethics; Browsing: Religion/Spirituality/Paranormal
217,Text,2006-01-16,Sons and Lovers,en,"Lawrence, D. H. (David Herbert), 1885-1930",Autobiographical fiction; England -- Fiction; Domestic fiction; Bildungsromans; Young men -- Fiction; Working class families -- Fiction,PR,Best Books Ever Listings; Banned Books from Anne Haight's list; Banned Books List from the American Library Association; Browsing: Culture/Civilization/Society; Browsing: Literature; Browsing: Fiction
218,Text,2008-07-03,"C. Iuli Caesaris De Bello Gallico, I-IV",la,"Caesar, Julius, 100 BCE-44 BCE","Gaul -- History -- Gallic Wars, 58-51 B.C.",DC; PA,Classical Antiquity; Browsing: History - European; Browsing: History - General; Browsing: History - Warfare
219,Text,2006-01-09,Heart of Darkness,en,"Conrad, Joseph, 1857-1924",Africa -- Fiction; Europeans -- Africa -- Fiction; Trading posts -- Fiction; Degeneration -- Fiction; Imperialism -- Fiction; Psychological fiction,PR,Best Books Ever Listings; Movie Books; Browsing: Culture/Civilization/Society; Browsing: Literature; Browsing: Fiction
220,Text,2006-01-09,The Secret Sharer,en,"Conrad, Joseph, 1857-1924",Sea stories; Psychological fiction; Ship captains -- Fiction; Fugitives from justice -- Fiction,PR,Browsing: Literature; Browsing: Fiction
221,Text,1995-02-01,The Return of Sherlock Holmes,en,"Doyle, Arthur Conan, 1859-1930","Holmes, Sherlock (Fictitious character) -- Fiction; Private investigators -- England -- Fiction; Detective and mystery stories, English",PR,Detective Fiction; Browsing: Crime/Mystery; Browsing: Literature; Browsing: Fiction
222,Text,1995-02-01,The Moon and Sixpence,en,"Maugham, W. Somerset (William Somerset), 1874-1965",England -- Fiction; Psychological fiction; Painters -- Fiction; Tahiti (French Polynesia : Island) -- Fiction,PR,Contemporary Reviews; Browsing: Culture/Civilization/Society; Browsing: Literature; Browsing: Fiction
223,Text,1995-02-01,The wisdom of Father Brown,en,"Chesterton, G. K. (Gilbert Keith), 1874-1936","England -- Fiction; Clergy -- Fiction; Detective and mystery stories, English; Catholics -- Fiction; Brown, Father (Fictitious character) -- Fiction",PR,Detective Fiction; Browsing: Crime/Mystery; Browsing: Literature; Browsing: Fiction
224,Text,2008-07-11,A pair of blue eyes,en,"Hardy, Thomas, 1840-1928",Didactic fiction; Triangles (Interpersonal relations) -- Fiction; Wessex (England) -- Fiction; Separation (Psychology) -- Fiction; Elopement -- Fiction,PR,Browsing: Culture/Civilization/Society; Browsing: Literature; Browsing: Fiction
225,Text,2008-07-11,At the Back of the North Wind,en,"MacDonald, George, 1824-1905",Fairy tales,PR; PZ,Children's Literature; Browsing: Children & Young Adult Reading; Browsing: Literature
226,Text,1995-03-01,Cicero's Orations,la,"Cicero, Marcus Tullius, 107 BCE-44 BCE","Speeches, addresses, etc., Latin; Rome -- History -- 53-44 B.C. -- Sources",PA,Classical Antiquity; Browsing: History - General; Browsing: Language & Communication; Browsing: Literature
227,Text,1995-03-01,Aeneidos,la,"Virgil, 71 BCE-20 BCE","Aeneas (Legendary character) -- Poetry; Legends -- Rome -- Poetry; Epic poetry, Latin",PA,Classical Antiquity; Best Books Ever Listings; Harvard Classics; Browsing: History - Ancient; Browsing: Literature; Browsing: Poetry
228,Text,1995-03-01,The Aeneid,en,"Virgil, 71 BCE-20 BCE; Dryden, John, 1631-1700 [Translator]","Aeneas (Legendary character) -- Poetry; Legends -- Rome -- Poetry; Epic poetry, Latin -- Translations into English",PA,Classical Antiquity; Best Books Ever Listings; Poetry; Harvard Classics; Browsing: History - Ancient; Browsing: Literature; Browsing: Poetry
229,Text,1995-03-01,The Bucolics and Eclogues,la,"Virgil, 71 BCE-20 BCE","Country life -- Rome -- Poetry; Pastoral poetry, Latin",PA,Classical Antiquity; Browsing: History - Ancient; Browsing: Literature; Browsing: Poetry
230,Text,1995-03-01,The Bucolics and Eclogues,en,"Virgil, 71 BCE-20 BCE","Pastoral poetry, Latin -- Translations into English; Country life -- Rome -- Poetry",PA,Classical Antiquity; Browsing: History - General; Browsing: Literature; Browsing: Poetry
231,Text,1995-03-01,Georgicon,la,"Virgil, 71 BCE-20 BCE","Didactic poetry, Latin; Agriculture -- Poetry",PA,Classical Antiquity; Browsing: History - Ancient; Browsing: Literature; Browsing: Poetry
232,Text,1995-03-01,The Georgics,en,"Virgil, 71 BCE-20 BCE; Rhoades, James, 1841-1923 [Translator]","Agriculture -- Poetry; Didactic poetry, Latin -- Translations into English",PA,Browsing: Literature; Browsing: Poetry; Browsing: Science - Earth/Agricultural/Farming; Browsing: Fiction
233,Text,1995-03-01,Sister Carrie: A Novel,en,"Dreiser, Theodore, 1871-1945",New York (N.Y.) -- Fiction; Didactic fiction; Young women -- Fiction; Chicago (Ill.) -- Fiction; Mistresses -- Fiction,PS,Browsing: Culture/Civilization/Society; Browsing: Literature; Browsing: Fiction
234,Text,2008-07-02,Child Christopher and Goldilind the Fair,en,"Morris, William, 1834-1896",Fantasy fiction,PR,Fantasy; Browsing: Literature; Browsing: Science-Fiction & Fantasy; Browsing: Fiction
235,Text,1995-03-01,William Gibson Interviewed,en,"Salza, Giuseppe","Gibson, William, 1914-2008",PS,Browsing: Literature
236,Text,2006-01-16,The Jungle Book,en,"Kipling, Rudyard, 1865-1936","Short stories; Animals -- Fiction; Jungles -- Fiction; India -- Fiction; Jungle animals -- Fiction; Mowgli (Fictitious character) -- Fiction; Adventure stories, English; Feral children -- Fiction; India -- History -- 19th century -- Fiction",PR,Scouts; Children's Literature; Movie Books; Contemporary Reviews; Browsing: Children & Young Adult Reading; Browsing: Culture/Civilization/Society; Browsing: Literature; Browsing: Fiction
237,Text,1995-03-01,Sexti Properti Elegiarvm: Liber Primvs,la,"Propertius, Sextus","Latin poetry; Rome -- Poetry; Man-woman relationships -- Poetry; Elegiac poetry, Latin; Love poetry, Latin",PA,Browsing: Literature; Browsing: Poetry
238,Text,2008-07-03,Dear Enemy,en,"Webster, Jean, 1876-1916",Orphans -- Fiction,PZ; PS,"Bestsellers, American, 1895-1923; Browsing: Literature; Browsing: Fiction"
239,StillImage,1995-03-01,Radar Map of the United States,en,United States,United States -- Maps,G,Browsing: Travel & Geography
240,Text,1995-04-01,Stories from the Old Attic,en,"Harris, Robert A. (Robert Alan), 1950-",Fiction; Short stories; Fables,PS,Browsing: Literature; Browsing: Fiction
241,Text,2008-07-02,"Clotelle; Or, The Colored Heroine, a tale of the Southern States; Or, The President's Daughter",en,"Brown, William Wells, 1814?-1884","Children of presidents -- Fiction; Enslaved women -- Fiction; Jefferson, Thomas, 1743-1826 -- Relations with women -- Fiction; Domestic fiction; Illegitimate children -- Fiction; African American women -- Fiction; African American families -- Fiction",PS,African American Writers; Browsing: Culture/Civilization/Society; Browsing: Literature; Browsing: Fiction
242,Text,2008-07-11,My Ántonia,en,"Cather, Willa, 1873-1947",Nebraska -- Fiction; Frontier and pioneer life -- Nebraska -- Fiction; Western stories; Domestic fiction; Friendship -- Fiction; Married women -- Fiction; Farm life -- Fiction; Women pioneers -- Fiction; Women immigrants -- Fiction; Farmers' spouses -- Fiction; Czech Americans -- Fiction,PS,Browsing: Culture/Civilization/Society; Browsing: Literature; Browsing: Fiction
243,Text,2006-03-15,"The forged coupon, and other stories",en,"Tolstoy, Leo, graf, 1828-1910; Wright, C. T. Hagberg (Charles Theodore Hagberg), 1862-1940 [Editor]","Short stories, Russian -- Translations into English; Russian fiction -- Translations into English; Tolstoy, Leo, graf, 1828-1910 -- Translations into English",PG,Browsing: Literature; Browsing: Fiction
244,Text,1995-04-01,A Study in Scarlet,en,"Doyle, Arthur Conan, 1859-1930","Holmes, Sherlock (Fictitious character) -- Fiction; Private investigators -- England -- Fiction; Detective and mystery stories; England -- Fiction",PR,Detective Fiction; Browsing: Crime/Mystery; Browsing: Literature; Browsing: Fiction
245,Text,2004-07-10,Life on the Mississippi,en,"Twain, Mark, 1835-1910","Mississippi River -- Description and travel; Mississippi River Valley -- Social life and customs -- 19th century; Authors, American -- 19th century -- Biography; Pilots and pilotage -- Mississippi River; Twain, Mark, 1835-1910 -- Travel -- Mississippi River",PS,Browsing: Biographies; Browsing: Culture/Civilization/Society; Browsing: History - American; Browsing: Literature; Browsing: Travel & Geography
246,Text,1995-04-01,The Rubaiyat of Omar Khayyam,en,"Omar Khayyam, 1048-1122; FitzGerald, Edward, 1809-1883 [Translator]",Persian poetry -- Translations into English,PK,Browsing: Culture/Civilization/Society; Browsing: Literature; Browsing: Poetry
247,Text,1995-04-01,Webster's Unabridged Dictionary (1st 100 Pages),en,"Webster, Noah, 1758-1843",English language -- Dictionaries,AG; PE,Browsing: Encyclopedias/Dictionaries/Reference; Browsing: Language & Communication
248,Text,1995-04-01,Webster's Unabridged Dictionary (2nd 100 Pages),en,"Webster, Noah, 1758-1843",English language -- Dictionaries,AG; PE,Browsing: Encyclopedias/Dictionaries/Reference
249,Text,1995-04-01,French Cave Paintings,en,,"Cave paintings -- France -- Vallon-Pont-d'Arc; Art, Prehistoric -- France -- Vallon-Pont-d'Arc; Chauvet Cave (France)",N,Browsing: Art & Photography; Browsing: History - General
250,Text,1995-04-01,"A Brief History of the Internet
The Bright Side: The Dark Side",en,"Hart, Michael, 1947-2011; Fuller, Maxwell",Internet -- History; Computer networks -- United States -- History,TK,Browsing: Computers & Technology; Browsing: History - General
251,Text,1995-04-01,1995 United States Congressional Address Book,en,United States,United States. Congress,JK,Browsing: History - American; Browsing: Politics
252,Text,1995-04-01,"Copyright Law of the United States of America
Contained in Title 17 of the United States Code",en,Library of Congress. Copyright Office; United States,Copyright -- United States,KF,Browsing: Law & Criminology
253,Text,1995-04-01,The Universal Copyright Convention (1988),en,Coalition for Networked Information,"Copyright, International",JX,Browsing: Encyclopedias/Dictionaries/Reference; Browsing: Law & Criminology; Browsing: Politics
254,Text,2008-07-09,"The Second Story of Meno
A Continuation of Socrates' Dialogue with Meno in Which the Boy Proves Root 2 is Irrational",en,Unknown,Mathematics,QA,Browsing: Mathematics; Browsing: Philosophy & Ethics; Browsing: Science - General
255,Text,1995-04-01,"QREAD, Etext Reader for Windows",en,"Scavezze, Dan",Electronic book readers,Z,Browsing: Computers & Technology; Browsing: Encyclopedias/Dictionaries/Reference
256,MovingImage,1995-05-01,Motion Picture of Rotating Earth,en,United States,World maps,G,Browsing: Culture/Civilization/Society; Browsing: Science - General; Browsing: Travel & Geography
257,Text,1995-05-01,Troilus and Criseyde,en,"Chaucer, Geoffrey, 1343?-1400",Troilus (Legendary character) -- Poetry; Trojan War -- Poetry; Cressida (Fictitious character) -- Poetry; Troy (Extinct city) -- Poetry,PR,Browsing: Literature; Browsing: Poetry
258,Text,2008-06-29,Poems by Adam Lindsay Gordon,en,"Gordon, Adam Lindsay, 1833-1870; Clarke, Marcus Andrew Hislop, 1846-1881 [Editor]","Gordon, Adam Lindsay, 1833-1870; Australia -- Poetry",PR,Browsing: Culture/Civilization/Society; Browsing: Literature; Browsing: Poetry
259,Text,2008-07-02,Ballads of a Cheechako,en,"Service, Robert W. (Robert William), 1874-1958",Frontier and pioneer life -- Yukon -- Poetry; Klondike River Valley (Yukon) -- Gold discoveries -- Poetry,PS,Browsing: Culture/Civilization/Society; Browsing: Poetry; Browsing: Fiction
260,Text,2008-07-05,An Introduction to the Study of Robert Browning's Poetry,en,"Browning, Robert, 1812-1889; Corson, Hiram, 1828-1911","Browning, Robert, 1812-1889; Browning, Robert, 1812-1889 -- Bibliography; Browning, Robert, 1812-1889 -- Criticism and interpretation",PR,Browsing: Literature; Browsing: Poetry
261,Text,2008-07-03,A Dome of Many-Coloured Glass,en,"Lowell, Amy, 1874-1925",American poetry,PS,Poetry; Browsing: Culture/Civilization/Society; Browsing: Literature; Browsing: Poetry
262,Text,1995-05-01,The Collected Poems of Rupert Brooke,en,"Brooke, Rupert, 1887-1915; Woodberry, George Edward, 1855-1930 [Author of introduction, etc.]; Lavington, Margaret [Contributor]","English poetry; Poets, English -- 20th century -- Biography; Brooke, Rupert, 1887-1915",PR,Poetry; Browsing: Biographies; Browsing: Literature; Browsing: Poetry
263,Text,1995-05-01,"Trees, and Other Poems",en,"Kilmer, Joyce, 1886-1918","Poetry, Modern -- 20th century",PS,Browsing: Literature; Browsing: Poetry
264,Text,2008-07-09,"Main Street, and Other Poems",en,"Kilmer, Joyce, 1886-1918","City and town life -- Poetry; Poetry, Modern -- 20th century",PS,Browsing: Literature; Browsing: Poetry
265,Text,2008-07-03,The Life and Death of Cormac the Skald,en,"Collingwood, W. G. (William Gershom), 1854-1932 [Translator]; Jón Stefánsson, 1862- [Translator]","Kormákr Ögmundarson, approximately 935-970 -- Romances; Sagas -- Translations into English",PT,Browsing: History - Medieval/The Middle Ages; Browsing: Literature; Browsing: Fiction
266,Text,2008-07-03,"Confessio Amantis; Or, Tales of the Seven Deadly Sins",en,"Gower, John, 1325?-1408; Macaulay, G. C. (George Campbell), 1852-1915 [Editor]","Courtly love -- Poetry; Christian poetry, English (Middle); Love poetry, English (Middle); Christian ethics -- Poetry",PR,Browsing: History - Medieval/The Middle Ages; Browsing: Literature; Browsing: Poetry
267,Text,1995-05-01,The Touchstone,en,"Wharton, Edith, 1862-1937",Psychological fiction; Rejection (Psychology) -- Fiction; Married people -- Fiction; Triangles (Interpersonal relations) -- Fiction; Women novelists -- Fiction; Love-letters -- Fiction,PS,Browsing: Literature; Browsing: Psychiatry/Psychology; Browsing: Fiction
