Text#,Type,Issued,Title,Language,Authors,Subjects,LoCC,Bookshelves
81,Text,1993-09-01,The Return of Tarzan,en,"Burroughs, Edgar Rice, 1875-1950",Tarzan (Fictitious character) -- Fiction; Fantasy fiction; Adventure stories,PZ; PS,Browsing: Literature; Browsing: Science-Fiction & Fantasy; Browsing: Fiction
82,Text,2008-06-25,Ivanhoe: A Romance,en,"Scott, Walter, 1771-1832","Historical fiction; Knights and knighthood -- Fiction; Love stories; Triangles (Interpersonal relations) -- Fiction; Great Britain -- History -- Richard I, 1189-1199 -- Fiction; Jews -- England -- Fiction; Ivanhoe, Wilfred of, Sir (Fictitious character) -- Fiction; Anglo-Saxons -- Fiction; Normans -- Great Britain -- Fiction",PR,Historical Fiction; Best Books Ever Listings; Browsing: Culture/Civilization/Society; Browsing: History - Medieval/The Middle Ages; Browsing: Literature; Browsing: Fiction
83,Text,1993-09-01,"From the Earth to the Moon; and, Round the Moon",en,"Verne, Jules, 1828-1905",Science fiction; Space flight to the moon -- Fiction; Moon -- Fiction; Space ships -- Fiction; Manned space flight -- Fiction,PQ,Science Fiction; Movie Books; Browsing: Literature; Browsing: Science-Fiction & Fantasy; Browsing: Fiction
84,Text,1993-10-01,"Frankenstein; Or, The Modern Prometheus",en,"Shelley, Mary Wollstonecraft, 1797-1851","Science fiction; Horror tales; Gothic fiction; Scientists -- Fiction; Monsters -- Fiction; Frankenstein, Victor (Fictitious character) -- Fiction; Frankenstein's monster (Fictitious character) -- Fiction",PR,Gothic Fiction; Movie Books; Precursors of Science Fiction; Science Fiction by Women; Browsing: Culture/Civilization/Society; Browsing: Gender & Sexuality Studies; Browsing: Literature; Browsing: Science-Fiction & Fantasy; Browsing: Fiction
85,Text,1993-10-01,The Beasts of Tarzan,en,"Burroughs, Edgar Rice, 1875-1950",Tarzan (Fictitious character) -- Fiction; Fantasy fiction; Jungle animals -- Fiction; Adventure stories,PZ; PS,Adventure; Movie Books; Browsing: Literature; Browsing: Science-Fiction & Fantasy; Browsing: Fiction
86,Text,2004-07-07,A Connecticut Yankee in King Arthur's Court,en,"Twain, Mark, 1835-1910",Fantasy fiction; Satire; Knights and knighthood -- Fiction; Arthurian romances -- Adaptations; Time travel -- Fiction; Americans -- Great Britain -- Fiction; Kings and rulers -- Fiction; Britons -- Fiction,PS,Precursors of Science Fiction; Arthurian Legends; Browsing: Culture/Civilization/Society; Browsing: Literature; Browsing: Science-Fiction & Fantasy; Browsing: Fiction
87,Text,1993-10-01,The 1993 CIA World Factbook,en,United States. Central Intelligence Agency,"World politics -- Handbooks, manuals, etc.; Geography -- Handbooks, manuals, etc.; Political science -- Handbooks, manuals, etc.; Political statistics -- Handbooks, manuals, etc.",G,CIA World Factbooks; Browsing: Encyclopedias/Dictionaries/Reference; Browsing: Politics; Browsing: Travel & Geography
88,Text,1993-11-01,Price/Cost Indexes from 1875 to 1989; Estimated to 2010,en,"Hart, Michael, 1947-2011",Cost and standard of living,HG,Browsing: Economics; Browsing: Sociology
89,Text,1993-11-01,"North American Free Trade Agreement, 1992 Oct. 7 Tariff Phasing Descriptions",en,Canada,"Canada. Treaties, etc. 1992 Oct. 7; Tariff -- Law and legislation -- North America; Free trade -- North America; Foreign trade regulation -- North America; Free trade -- United States; Free trade -- Canada; Free trade -- Mexico",KDZ,Browsing: Economics; Browsing: Law & Criminology; Browsing: Politics
90,Text,1993-11-01,The Son of Tarzan,en,"Burroughs, Edgar Rice, 1875-1950",Tarzan (Fictitious character) -- Fiction; Fantasy fiction; Adventure stories,PZ; PS,Adventure; Movie Books; Contemporary Reviews; Browsing: Science-Fiction & Fantasy; Browsing: Fiction
91,Text,2004-09-14,Tom Sawyer Abroad,en,"Twain, Mark, 1835-1910","Adventure stories; Sawyer, Tom (Fictitious character) -- Fiction; Balloon ascensions -- Fiction; Americans -- Foreign countries -- Fiction",PS,Browsing: Literature; Browsing: Travel & Geography; Browsing: Fiction
92,Text,1993-12-01,Tarzan and the Jewels of Opar,en,"Burroughs, Edgar Rice, 1875-1950",Tarzan (Fictitious character) -- Fiction; Fantasy fiction; Adventure stories,PS,Adventure; Movie Books; Browsing: Science-Fiction & Fantasy; Browsing: Fiction
93,Text,2004-09-14,"Tom Sawyer, Detective",en,"Twain, Mark, 1835-1910","Sawyer, Tom (Fictitious character) -- Fiction; Mystery fiction",PS,Browsing: Crime/Mystery; Browsing: Literature; Browsing: Fiction
